{
  "kind": "repobrief.semantic_platforms",
  "version": "v1",
  "status": "optional_locked",
  "default_enabled": false,
  "unsupported_target_policy": "fail_closed",
  "core_dependency": false,
  "snapshot_read_dependency": false,
  "default_ranking_dependency": false,
  "compiler": {
    "script": "scripts/release/compile_semantic_lock.sh",
    "image": "mcr.microsoft.com/playwright/python:v1.61.0-noble@sha256:a9731514f24121d1dcd25d58d0a38146646d290a5998fd80d3e533e7b5e21c69",
    "reproduction_command": "scripts/release/compile_semantic_lock.sh --check"
  },
  "supported_targets": [
    {
      "id": "cpython-312-linux-x86_64",
      "python_implementation": "CPython",
      "python_version": "3.12",
      "operating_system": "linux",
      "architecture": "x86_64",
      "accelerator": "cpu_only",
      "artifact_policy": "selected_binary_wheels_only",
      "input": {
        "path": "requirements/repobrief-semantic-linux-x86_64-py312.in",
        "sha256": "6d741eed8d3ccf3d9fbdc2fef0c95df119d6fd561db42bf18603083909a1daf9"
      },
      "constraints": {
        "path": "requirements/repobrief-semantic-linux-x86_64-py312.constraints.txt",
        "sha256": "2eea6931d07bad9331499ce2aeff89e8740b1650be3650262acde9fe041a4624"
      },
      "lock": {
        "path": "requirements/repobrief-semantic-linux-x86_64-py312.lock.txt",
        "sha256": "3e8a5accb5c50d525a68740b7f0c4009c97ebce54e1832c99e6a1ed92287fd2e"
      },
      "package_count": 58,
      "root_pins": {
        "sentence-transformers": "5.6.0",
        "torch": "2.13.0+cpu"
      },
      "install_verification_command": "scripts/release/compile_semantic_lock.sh --verify-install <empty-target>"
    }
  ],
  "does_not_establish": [
    "semantic_quality",
    "cross_platform_completeness",
    "vulnerability_absence",
    "default_promotion_readiness",
    "gpu_support",
    "model_availability",
    "model_license_approval"
  ]
}
